Issue Number,Parent Issue,Issue URL,Title,Assignees,Status,Type,Area,Priority,Initiative,Version,Size,Estimate,Time Spent,Remaining Work,Σ Estimate,Σ Time Spent,Σ Remaining Work,External Reference,Comments
1317,,https://github.com/serverlessworkflow/sdk-java/issues/1317,Wrong field usage on FAult lifecycle cloud event,fjtirado,In review,,Runtimes,Normal,,2026/Q2,S,0.2,0.2,,0.2,0.2,0.0,,
1314,,https://github.com/serverlessworkflow/sdk-java/issues/1314,Make CloudEvent type constants in AbstractLifeCyclePublisher public,ricardozanini,In review,,Runtimes,Normal,,2026/Q2,XS,0.1,0.1,0.0,0.1,0.1,0.0,,
1206,,https://github.com/serverlessworkflow/sdk-java/issues/1206,Feat: Implement correlation on event filter,fjtirado,Next,,Runtimes,Normal,,2026/Q2,L,1.0,,1.0,1.0,0.0,1.0,,
1087,,https://github.com/serverlessworkflow/sdk-java/issues/1087,Add support to a2a,fjtirado,Next,,Runtimes,Minor,,2026/Q2,L,1.0,,,1.0,0.0,0.0,,
455,,https://github.com/quarkiverse/quarkus-flow/issues/455,Add support to IBM Bob,mcruzdev,In progress,,,,,,,,,,0.0,0.0,0.0,,
450,112,https://github.com/quarkiverse/quarkus-flow/issues/450,docs: Add a reference page for Performance Results,gmunozfe,In progress,,,,,,,,,,0.0,0.0,0.0,,
448,,https://github.com/quarkiverse/quarkus-flow/issues/448,Add Structured Logging Listener for Workflow Lifecycle Events,ricardozanini,In review,,Runtimes,Normal,,2026/Q2,M,0.1,,0.0,0.1,0.0,0.0,,
425,,https://github.com/quarkiverse/quarkus-flow/issues/425,docs: Improve docs module to execute tests during maven build,domhanak,Backlog,,Docs,Major,,2026/Q2,M,0.6,0.0,0.6,0.6,0.0,0.6,,
393,,https://github.com/quarkiverse/quarkus-flow/issues/393,docs: Implementation of Java DSL Cookbook,domhanak,In progress,,Docs,Major,,2026/Q2,M,0.4,0.3,0.3,0.4,0.3,0.3,,
376,,https://github.com/quarkiverse/quarkus-flow/issues/376,Avoid hardcoding application URI in DevUIJsonRPCTest tests,mcruzdev,Next,,Tooling,Major,,2026/Q2,M,1.0,,0.8,1.0,0.0,0.8,,
374,,https://github.com/quarkiverse/quarkus-flow/issues/374,bug: Newsletter is not working with DevUI Lifecycle Management,mcruzdev,In progress,,Tooling,Critical,,2026/Q2,M,0.4,0.4,0.0,0.4,0.4,0.0,,
317,112,https://github.com/quarkiverse/quarkus-flow/issues/317,bug: jpa persistence exceptions in engine after heavy load,gmunozfe,In progress,,Runtimes,Major,,2026/Q2,M,0.4,,0.2,0.4,0.0,0.2,,
273,226,https://github.com/quarkiverse/quarkus-flow/issues/273,docs: Add an instance correlation pattern,ricardozanini,In progress,,Runtimes,Blocker,,2026/Q2,M,3.0,2.0,1.0,3.0,2.0,1.0,,
226,113,https://github.com/quarkiverse/quarkus-flow/issues/226,feat: Feedback from my demo implementation,ricardozanini,In progress,,Runtimes,Blocker,,2026/Q2,XL,8.0,,8.0,12.0,3.0,9.0,,
168,113,https://github.com/quarkiverse/quarkus-flow/issues/168,docs: Add a new doc page/section: “Idempotency and Correlation”,mcruzdev,Next,,Docs,Major,,2026/Q2,,0.4,,0.4,0.4,0.0,0.4,,
166,113,https://github.com/quarkiverse/quarkus-flow/issues/166,feat: Ensure agent tools can access correlation metadata,mcruzdev,In progress,,Runtimes,Major,,2026/Q2,,2.0,,2.0,2.0,0.0,2.0,,
116,,https://github.com/quarkiverse/quarkus-flow/issues/116,epic: Introduce curated Camel connector catalog for Quarkus Flow,ricardozanini,Backlog,,Runtimes,Minor,,2026/Q3,,,,,0.0,0.0,0.0,,
114,,https://github.com/quarkiverse/quarkus-flow/issues/114,feat: OpenTelemetry tracing support for Quarkus Flow,wmedvede,Backlog,,Runtimes,Major,,2026/Q2,M,,,,0.0,0.0,0.0,,
113,,https://github.com/quarkiverse/quarkus-flow/issues/113,epic: Idempotency & correlation foundations for Quarkus Flow,mcruzdev,In progress,,Runtimes,Major,,2026/Q2,,4.4,2.0,2.4,21.8,8.0,13.8,,
112,,https://github.com/quarkiverse/quarkus-flow/issues/112,epic: Benchmark and Load Testing,gmunozfe,In progress,,Runtimes,Major,,2026/Q2,L,6.0,3.0,3.0,13.1,11.5,3.2,,
98,7,https://github.com/serverlessworkflow/editor/issues/98,feat: Review and increase E2E test coverage,lornakelly,Backlog,,Tooling,Minor,,2026/Q3,S,0.2,,,,,,,
97,7,https://github.com/serverlessworkflow/editor/issues/97,feat: Increase unit test coverage across core modules,lornakelly,Backlog,,Tooling,Minor,,2026/Q3,S,0.2,,,,,,,
96,5,https://github.com/serverlessworkflow/editor/issues/96,feat: Render diagram with validation errors displayed,lornakelly,Backlog,,Tooling,Normal,,2026/Q2,M,,,,,,,,
95,5,https://github.com/serverlessworkflow/editor/issues/95,Spike: Define approach for edge hover labels/tooltips,lornakelly,Backlog,,Tooling,Normal,,2026/Q2,S,0.2,,0.2,0.2,0.0,0.2,,
94,5,https://github.com/serverlessworkflow/editor/issues/94,feat: Implement drag-and-drop YAML/JSON workflow loading in Storybook,fantonangeli,Next,,Tooling,Normal,,2026/Q2,M,0.6,,0.6,0.6,0.0,0.6,,
90,6,https://github.com/serverlessworkflow/editor/issues/90,feat: Write integrator documentation,lornakelly,Backlog,,Tooling,Normal,,2026/Q3,S,0.2,,,0.0,0.0,0.0,,
89,6,https://github.com/serverlessworkflow/editor/issues/89,feat: Add specification example workflows as Storybook stories,lornakelly,Backlog,,Tooling,Minor,,2026/Q3,M,,,,0.0,0.0,0.0,,
88,6,https://github.com/serverlessworkflow/editor/issues/88,feat: Update Storybook setup and apply project styling,lornakelly,Backlog,,Tooling,Minor,,2026/Q3,M,,,,0.0,0.0,0.0,,
87,5,https://github.com/serverlessworkflow/editor/issues/87,feat: Apply container node styling (UX),lornakelly,Backlog,,Tooling,Normal,,2026/Q2,M,,,,0.0,0.0,0.0,,
86,5,https://github.com/serverlessworkflow/editor/issues/86,feat: Apply edge styling (UX),lornakelly,Backlog,,Tooling,Normal,,2026/Q2,M,,,,0.0,0.0,0.0,,
85,5,https://github.com/serverlessworkflow/editor/issues/85,feat: Apply node styling (UX),lornakelly,Backlog,,Tooling,Normal,,2026/Q2,M,,,,0.0,0.0,0.0,,
84,5,https://github.com/serverlessworkflow/editor/issues/84,feat: Add error boundary for diagram rendering,kumaradityaraj,Next,,Tooling,Normal,,2026/Q2,M,0.4,,0.4,0.4,0.0,0.4,,
83,5,https://github.com/serverlessworkflow/editor/issues/83,feat: Handle blocking content errors,lornakelly,Next,,Tooling,Normal,,2026/Q2,M,0.4,,0.4,0.4,0.0,0.4,,
82,5,https://github.com/serverlessworkflow/editor/issues/82,feat: Update auto-layout to handle containment (parent/child node sizing and positioning),lornakelly,Backlog,,Tooling,Normal,,2026/Q2,,,,,0.0,0.0,0.0,,
81,5,https://github.com/serverlessworkflow/editor/issues/81,feat: Update React Flow builder to support parent/child nesting,lornakelly,Backlog,,Tooling,Normal,,2026/Q2,,,,,0.0,0.0,0.0,,
80,5,https://github.com/serverlessworkflow/editor/issues/80,"feat: Add node containment support to composite tasks react flow components (do, for, fork, try",lornakelly,Backlog,,Tooling,Normal,,2026/Q2,L,2.0,,2.0,2.0,0.0,2.0,,
79,5,https://github.com/serverlessworkflow/editor/issues/79,feat: Create start/end node components,lornakelly,Backlog,,Tooling,Normal,,2026/Q2,S,0.2,,0.2,0.2,0.0,0.2,,
65,3,https://github.com/serverlessworkflow/editor/issues/65,feat: create a package.json validation CI,"lornakelly,fantonangeli",In progress,,Tooling,Normal,,2026/Q3,S,0.3,,0.3,0.3,0.0,0.3,,
59,4,https://github.com/serverlessworkflow/editor/issues/59,feat: Set up model to extendended graph structure generation and dummy auto-layout,handreyrc,In review,,Tooling,Major,,2026/Q2,S,0.5,,0.5,0.5,0.0,0.5,,
56,2,https://github.com/serverlessworkflow/editor/issues/56,feat: Convert tsc configuration to vite build,fantonangeli,In review,,Tooling,Normal,,Future,M,0.6,,0.6,0.6,0.0,0.6,,
54,5,https://github.com/serverlessworkflow/editor/issues/54,feat: Integrate ELKjs for automatic diagram layout,lornakelly,Backlog,,Tooling,Normal,,2026/Q2,M,0.8,,0.8,0.8,0.0,0.8,,
53,5,https://github.com/serverlessworkflow/editor/issues/53,feat: Build minimal React Flow diagram from model,lornakelly,Backlog,,Tooling,Normal,,2026/Q2,M,1.0,,1.0,1.0,0.0,1.0,,
52,,https://github.com/quarkiverse/quarkus-flow/issues/52,epic: Runner API (Load/Run Workflows at Runtime),ricardozanini,Backlog,,Runtimes,,,2026/Q3,,,,,0.0,0.0,0.0,,
52,5,https://github.com/serverlessworkflow/editor/issues/52,feat: Define edge types and create React Flow edge components,lornakelly,Next,,Tooling,Normal,,2026/Q2,M,0.8,,0.8,0.8,0.0,0.8,,
51,,https://github.com/quarkiverse/quarkus-flow/issues/51,epic: Integrate Serverless Workflow Editor into DevUI,lornakelly,Backlog,,Tooling,Major,,2026/Q3,,,,,0.0,0.0,0.0,,
51,5,https://github.com/serverlessworkflow/editor/issues/51,feat: Define node types and create React Flow node components,handreyrc,In progress,,Tooling,Normal,,2026/Q2,M,0.6,,0.6,0.6,0.0,0.6,,
50,5,https://github.com/serverlessworkflow/editor/issues/50,Spike: Design for workflow diagram,lornakelly,In progress,,Tooling,Major,,2026/Q2,M,1.0,,0.4,1.0,0.0,0.4,,
49,,https://github.com/quarkiverse/quarkus-flow/issues/49,epic: Add Workflow Management Console,fantonangeli,Backlog,,Tooling,Minor,,2026/Q2,,,,,4.0,2.4,0.0,,
35,2,https://github.com/serverlessworkflow/editor/issues/35,Add support for dark and light theme,kumaradityaraj,In review,,Tooling,Normal,,2026/Q2,S,1.0,0.1,0.0,1.0,0.1,0.0,,
19,3,https://github.com/serverlessworkflow/editor/issues/19,Enable GitHub CodeQL scanning,fantonangeli,Next,,Tooling,Normal,,2026/Q2,S,0.1,,0.0,0.1,0.0,0.0,,
17,2,https://github.com/serverlessworkflow/editor/issues/17,Set up Playwright end-to-end testing,kumaradityaraj,In review,,Tooling,Normal,,2026/Q2,S,1.0,1.0,0.0,1.0,1.0,0.0,,
9,2,https://github.com/serverlessworkflow/editor/issues/9,Update readme with folder structure,lornakelly,In review,,Tooling,Normal,,2026/Q2,S,0.1,0.1,0.0,0.1,0.1,0.0,,
7,1,https://github.com/serverlessworkflow/editor/issues/7,"Epic: Hardening, testing, and user feedback incorporation",lornakelly,Backlog,,Tooling,Major,,2026/Q3,L,0.0,0.0,0.0,0.0,0.0,0.0,,
6,1,https://github.com/serverlessworkflow/editor/issues/6,Epic: Documentation & Examples,lornakelly,Backlog,,Tooling,Major,,2026/Q3,L,0.0,0.0,0.0,0.0,0.0,0.0,,
5,1,https://github.com/serverlessworkflow/editor/issues/5,Epic: Render Workflows as Read-Only Diagrams,lornakelly,Backlog,,Tooling,Major,,2026/Q3,XL,0.0,0.0,0.0,8.0,0.0,7.4,,
4,1,https://github.com/serverlessworkflow/editor/issues/4,Epic: Typescript SDK integration and model validation,lornakelly,Backlog,,Tooling,Major,,2026/Q2,L,0.0,0.0,0.0,1.7,1.4,0.9,,
3,1,https://github.com/serverlessworkflow/editor/issues/3,"Epic: Development Workflows, CI/CD, and Quality Gates",lornakelly,In progress,,Tooling,Major,,2026/Q2,L,0.0,0.0,0.0,4.5,1.7,0.3,,
2,1,https://github.com/serverlessworkflow/editor/issues/2,Epic: Editor foundation and repository scaffolding,lornakelly,In progress,,Tooling,Major,,2026/Q2,L,0.0,0.0,0.0,7.4,6.2,0.6,,
1,,https://github.com/serverlessworkflow/editor/issues/1,Epic: Serverless Workflow Editor MVP,lornakelly,Backlog,,Tooling,Major,,2026/Q3,XL,0.0,0.0,0.0,21.6,9.3,9.2,,
